id,concern,primary_recommendation,alternative_1,alternative_2,selection_criteria,pros,cons,best_for,avoid_for
TS001,"Meta Framework","Next.js","Nuxt.js","SvelteKit","React ecosystem, SSR/SSG needs, Vercel deployment","Excellent DX, hybrid rendering, great DX","Can be complex, Vercel lock-in potential","React projects, e-commerce, SaaS","Simple static sites, non-React teams"
TS002,"Vue Meta Framework","Nuxt.js","Astro","None","Vue ecosystem, SSR/SSG needs, full-stack","Vue DX, auto-imports, modules","Smaller community than Next","Vue projects, content sites","Non-Vue teams"
TS003,"Svelte Framework","SvelteKit","Astro","None","Svelte preference, performance critical","Smallest bundles, simple syntax","Smaller ecosystem","Performance-critical apps","Large teams needing React ecosystem"
TS004,"Content Site Framework","Astro","Next.js","11ty","Content-focused, minimal JS needed","Zero JS by default, multiple frameworks","Less suited for apps","Blogs, docs, marketing sites","Interactive web apps"
TS005,"SPA Framework","React","Vue","Angular","No SSR needed, rich interactivity","Large ecosystem, hiring pool","SEO challenges, bundle size","Dashboards, admin panels, internal tools","SEO-critical sites"
TS006,"Global State Management","Zustand","Jotai","Redux Toolkit","Simple, performant, TypeScript-first","Minimal boilerplate, hooks-based","Less structure than Redux","Most React apps","Complex state with time-travel debugging"
TS007,"Enterprise State","Redux Toolkit","Zustand","MobX","Time-travel debugging, middleware needs","DevTools, middleware, patterns","More boilerplate","Large enterprise apps","Simple apps"
TS008,"Server Cache","TanStack Query","SWR","RTK Query","API caching, optimistic updates","Auto caching, deduplication, devtools","Learning curve","Any app with API calls","Apps without API calls"
TS009,"Form Handling","React Hook Form","Formik","TanStack Form","Complex forms, validation needs","Performance, validation integration","Schema setup required","Complex forms, multi-step","Simple forms"
TS010,"Styling Solution","Tailwind CSS","CSS Modules","Styled Components","Rapid development, consistency","Utility-first, no context switching","Class string length","Most projects","Teams preferring traditional CSS"
TS011,"CSS-in-JS","Styled Components","Emotion","Linaria","Dynamic styling, component-scoped","Scoped styles, theming","Runtime overhead","Component libraries, theming","Performance-critical apps"
TS012,"Component Library","shadcn/ui","MUI","Ant Design","Customizable, accessible, modern","Copy-paste, Radix primitives, Tailwind","Manual installation","Modern React apps","Teams wanting pre-built components"
TS013,"Testing E2E","Playwright","Cypress","Selenium","Cross-browser, modern DX","Fast, reliable, multi-browser","Setup complexity","All projects needing E2E","Simple projects"
TS014,"Testing Unit","Vitest","Jest","Node test runner","Fast, Vite-native, compatible","Speed, Jest compatibility","Newer tool","Vite projects","Legacy Jest setups"
TS015,"Error Monitoring","Sentry","Bugsnag","Rollbar","Error tracking, performance","Rich context, source maps","Cost at scale","Production apps","Development only"
TS016,"APM Monitoring","Datadog","New Relic","Grafana","Full observability needed","Metrics, traces, logs in one","Cost, complexity","Enterprise apps","Simple apps"
TS017,"Analytics","Vercel Analytics","Google Analytics","Plausible","Privacy-focused, simple","Web Vitals, privacy-friendly","Less features than GA","Next.js on Vercel","Complex analytics needs"
TS018,"CDN","Cloudflare","Vercel Edge","AWS CloudFront","Global distribution, caching","Free tier, DDoS protection","Configuration complexity","All web projects","Internal-only apps"
TS019,"CI/CD","GitHub Actions","GitLab CI","CircleCI","GitHub integration","Native GitHub, marketplace","GitHub lock-in","GitHub projects","Non-GitHub teams"
TS020,"Deployment","Vercel","Netlify","AWS","Next.js, simplicity","Zero-config, preview deployments","Cost at scale","Next.js projects","Cost-sensitive large apps"
TS021,"Database ORM","Prisma","Drizzle","TypeORM","TypeScript, type safety","Type generation, migrations","Query limitations","TypeScript projects","Raw SQL preference"
TS022,"Authentication","NextAuth.js","Clerk","Auth0","Self-hosted, flexible","Multiple providers, self-hosted","Setup complexity","Next.js apps needing auth","Simple auth needs"
TS23,"Real-time","Socket.io","Pusher","Supabase Realtime","WebSocket, real-time features","Rooms, namespaces, fallbacks","Server resource usage","Chat, collaboration","Simple polling sufficient"
TS024,"UI Testing","Storybook","Ladle","Histoire","Component documentation","Visual testing, documentation","Setup complexity","Component libraries","Simple projects"
TS025,"Bundle Analysis","webpack-bundle-analyzer","source-map-explorer","Bundlewatch","Bundle optimization","Visual analysis","Manual analysis needed","All production apps","Development only"
